question,answer
What are the admission requirements?,"The admission requirements include academic transcripts, English proficiency test scores, and a personal statement."
How much is the tuition fee?,The tuition fee varies depending on the course. Please refer to the official university website for detailed fee structures.
What is the duration of the course?,"Most undergraduate courses are three years long, while postgraduate courses vary from one to two years."
Is accommodation provided?,"Yes, the university provides on-campus accommodation for both domestic and international students."
How can I apply for a scholarship?,You can apply for a scholarship through the university's scholarship portal. Make sure to check the eligibility criteria and deadlines.
